{"baseBranch":"main","baseSha":"aaaaaaaaaaaaaaaaaaaaaaaaaaaaaaaaaaaaaaaa","createdAt":"2026-09-01T00:00:00.000Z","featureBranch":"squire/aidev-222-run_example01","fingerprint":"bea46605affd9cff7d3911bfb72bd696e1aa53f8d0f27b989307cd79c32ddfa6","kind":"squire-git-workspace-spec","objectFormat":"sha1","paths":{"artifactRoot":"artifacts/git/run_example01","controlRoot":"control/git/run_example01","repository":"/ticket/git/repo.git","worktree":"/ticket/workspace"},"repository":{"cloneUrl":"https://github.com/example/service.git","name":"service","owner":"example"},"runId":"run_example01","schemaVersion":1,"ticketIdentifier":"AIDEV-222"}
